{
  "id": "REQ-001",
  "type": "requirements",
  "status": "pending",
  "summary": "",
  "target_users": [],
  "goals": [],
  "must_have": [],
  "nice_to_have": [],
  "out_of_scope": [],
  "constraints": [],
  "assumptions": [],
  "success_criteria": [],
  "project_rigor_level": {
    "level": "",
    "why_it_fits": "",
    "quality_implications": {
      "testing": "",
      "documentation": "",
      "security_privacy": "",
      "shipping": ""
    }
  },
  "open_questions": [],
  "approval": {
    "status": "pending",
    "approved_by": null,
    "approved_at": null
  }
}
